{
  "evidence_id": "evidence_001",
  "evidence_schema_version": "1.0.0",
  "evidence_version": 1,
  "artifact_id": "artifact_001",
  "artifact_version": 1,
  "tenant_id": "tenant_demo",
  "portfolio_id": "portfolio_sydney",
  "case_id": "case_001",
  "trade_id": "trade_fx_001",
  "correlation_id": "corr_case_001",
  "evidence_kind": "SOURCE_OBSERVATION_HASH",
  "source_reference": {
    "reference_id": "obs_confirmation_001",
    "reference_version": 1,
    "scope": {
      "tenant_id": "tenant_demo",
      "portfolio_id": "portfolio_sydney",
      "case_id": "case_001",
      "trade_id": "trade_fx_001"
    },
    "observation_kind": "CONFIRMATION",
    "source_system": "FPML_CONFIRMATION",
    "source_version": "1",
    "content_hash": "sha256:aaaaaaaaaaaaaaaaaaaaaaaaaaaaaaaaaaaaaaaaaaaaaaaaaaaaaaaaaaaaaaaa"
  },
  "content_hash": "sha256:dddddddddddddddddddddddddddddddddddddddddddddddddddddddddddddddd",
  "media_type": "application/json",
  "classification": "RESTRICTED",
  "redaction_status": "NOT_REQUIRED",
  "producer": {
    "identity_type": "SYSTEM",
    "actor_id": "evidence_service"
  },
  "retention_class": "RESTRICTED",
  "captured_at": "2026-08-01T07:00:00Z",
  "created_at": "2026-08-01T07:00:01Z"
}
